<?xml version="1.0" encoding="UTF-8"?>
<!DOCTYPE hospital SYSTEM "benhvien.dtd">
<hospital>

    <appointment id="A001" date="2025-03-05" status="Đã khám">
        <patient id="P001">
            <name>Nguyễn Văn A</name>
            <dob>1990-07-15</dob>
            <phone>0901234567</phone>
            <address>123 Nguyễn Trãi, Cái Khế, TP.Cần Thơ</address>
        </patient>
        <doctor id="D001">
            <name>Trần Thị B</name>
            <specialty>Nội khoa</specialty>
            <phone>0987654321</phone>
        </doctor>
        <diagnosis>Cảm cúm thông thường</diagnosis>
        <treatment>Nghỉ ngơi, uống nhiều nước, thuốc hạ sốt</treatment>
        <fee>300000</fee>
    </appointment>
    
    <appointment id="A002" date="2025-03-06" status="Chưa khám">
        <patient id="P002">
            <name>Lê Thị C</name>
            <dob>1985-12-20</dob>
            <phone>0912345678</phone>
            <address>456 Lê Lai, Bình Thủy, TP.Cần Thơ</address>
        </patient>
        <doctor id="D002">
            <name>Phạm Minh D</name>
            <specialty>Tai Mũi Họng</specialty>
            <phone>0976543210</phone>
        </doctor>
        <diagnosis></diagnosis>
        <treatment></treatment>
        <fee>350000</fee>
    </appointment>
    
    <appointment id="A003" date="2025-03-07" status="Đã khám">
        <patient id="P003">
            <name>Hoàng Văn E</name>
            <dob>1995-03-10</dob>
            <phone>0923456789</phone>
            <address>789 Võ Văn Tần, Cái Răng, TP.Cần Thơ</address>
        </patient>
        <doctor id="D003">
            <name>Nguyễn Thị F</name>
            <specialty>Da liễu</specialty>
            <phone>0965432109</phone>
        </doctor>
        <diagnosis>Viêm da dị ứng</diagnosis>
        <treatment>Thuốc bôi da, tránh tiếp xúc chất gây dị ứng</treatment>
        <fee>400000</fee>
    </appointment>
    
    <appointment id="A004" date="2025-03-08" status="Chưa khám">
        <patient id="P004">
            <name>Võ Thành G</name>
            <dob>1988-09-25</dob>
            <phone>0934567890</phone>
            <address>321 Hai Bà Trưng, Bình Thủy, TP.Cần Thơ</address>
        </patient>
        <doctor id="D001">
            <name>Trần Thị B</name>
            <specialty>Nội khoa</specialty>
            <phone>0987654321</phone>
        </doctor>
        <diagnosis></diagnosis>
        <treatment></treatment>
        <fee>300000</fee>
    </appointment>

</hospital>
